{
  "schemaVersion": "scanner-summary-v1",
  "generationStatus": "GENERATED",
  "generatedAt": "2026-10-05T15:00:00.000Z",
  "universe": {
    "name": "OJK KEP-21/D.04/2026 — DES Periode I 2026 (21 Mei 2026)",
    "eligible": 612,
    "evaluated": 421
  },
  "watchlist": {
    "count": 91,
    "states": {
      "WATCHLIST": 0,
      "RESEARCH_CONFIRMED": 91,
      "WAITING_CONFIRMATION": 0,
      "EXTENDED": 0,
      "LIMITED_EVIDENCE": 0
    }
  },
  "items": [
    {
      "ticker": "ACES",
      "name": "PT Aspirasi Hidup Indonesia Tbk",
      "sector": "Barang Konsumen Non-Primer",
      "state": "RESEARCH_CONFIRMED",
      "stateLabel": "Terkonfirmasi Riset",
      "researchLens": [
        "UNDERVALUED"
      ],
      "evidenceStrength": "ADEQUATE",
      "primaryReason": "VALUATION_OPPORTUNITY",
      "freshness": "CURRENT",
      "detail": "/data/scanner/tickers/ACES.json",
      "fairValue": "/fair-value/?ticker=ACES"
    },
    {
      "ticker": "APII",
      "name": "PT Arita Prima Indonesia Tbk",
      "sector": "Perindustrian",
      "state": "RESEARCH_CONFIRMED",
      "stateLabel": "Terkonfirmasi Riset",
      "researchLens": [
        "UNDERVALUED"
      ],
      "evidenceStrength": "ADEQUATE",
      "primaryReason": "VALUATION_OPPORTUNITY",
      "freshness": "CURRENT",
      "detail": "/data/scanner/tickers/APII.json",
      "fairValue": "/fair-value/?ticker=APII"
    },
    {
      "ticker": "ARNA",
      "name": "PT Arwana Citramulia Tbk",
      "sector": "Perindustrian",
      "state": "RESEARCH_CONFIRMED",
      "stateLabel": "Terkonfirmasi Riset",
      "researchLens": [
        "UNDERVALUED"
      ],
      "evidenceStrength": "ADEQUATE",
      "primaryReason": "VALUATION_OPPORTUNITY",
      "freshness": "CURRENT",
      "detail": "/data/scanner/tickers/ARNA.json",
      "fairValue": "/fair-value/?ticker=ARNA"
    },
    {
      "ticker": "ASSA",
      "name": "PT Adi Sarana Armada Tbk",
      "sector": "Transportasi & Logistik",
      "state": "RESEARCH_CONFIRMED",
      "stateLabel": "Terkonfirmasi Riset",
      "researchLens": [
        "UNDERVALUED"
      ],
      "evidenceStrength": "ADEQUATE",
      "primaryReason": "VALUATION_OPPORTUNITY",
      "freshness": "CURRENT",
      "detail": "/data/scanner/tickers/ASSA.json",
      "fairValue": "/fair-value/?ticker=ASSA"
    },
    {
      "ticker": "AVIA",
      "name": "PT Avia Avian Tbk",
      "sector": "Barang Baku",
      "state": "RESEARCH_CONFIRMED",
      "stateLabel": "Terkonfirmasi Riset",
      "researchLens": [
        "UNDERVALUED"
      ],
      "evidenceStrength": "ADEQUATE",
      "primaryReason": "VALUATION_OPPORTUNITY",
      "freshness": "CURRENT",
      "detail": "/data/scanner/tickers/AVIA.json",
      "fairValue": "/fair-value/?ticker=AVIA"
    },
    {
      "ticker": "BANK",
      "name": "PT Bank Aladin Syariah Tbk",
      "sector": "Emiten Syariah / Perusahaan Publik Syariah",
      "state": "RESEARCH_CONFIRMED",
      "stateLabel": "Terkonfirmasi Riset",
      "researchLens": [
        "UNDERVALUED"
      ],
      "evidenceStrength": "ADEQUATE",
      "primaryReason": "VALUATION_OPPORTUNITY",
      "freshness": "CURRENT",
      "detail": "/data/scanner/tickers/BANK.json",
      "fairValue": "/fair-value/?ticker=BANK"
    },
    {
      "ticker": "BCIP",
      "name": "PT Bumi Citra Permai Tbk",
      "sector": "Properti & Real Estat",
      "state": "RESEARCH_CONFIRMED",
      "stateLabel": "Terkonfirmasi Riset",
      "researchLens": [
        "UNDERVALUED"
      ],
      "evidenceStrength": "ADEQUATE",
      "primaryReason": "VALUATION_OPPORTUNITY",
      "freshness": "CURRENT",
      "detail": "/data/scanner/tickers/BCIP.json",
      "fairValue": "/fair-value/?ticker=BCIP"
    },
    {
      "ticker": "BIRD",
      "name": "PT Blue Bird Tbk",
      "sector": "Transportasi & Logistik",
      "state": "RESEARCH_CONFIRMED",
      "stateLabel": "Terkonfirmasi Riset",
      "researchLens": [
        "UNDERVALUED"
      ],
      "evidenceStrength": "ADEQUATE",
      "primaryReason": "VALUATION_OPPORTUNITY",
      "freshness": "CURRENT",
      "detail": "/data/scanner/tickers/BIRD.json",
      "fairValue": "/fair-value/?ticker=BIRD"
    },
    {
      "ticker": "BISI",
      "name": "PT BISI International Tbk",
      "sector": "Barang Konsumen Primer",
      "state": "RESEARCH_CONFIRMED",
      "stateLabel": "Terkonfirmasi Riset",
      "researchLens": [
        "UNDERVALUED"
      ],
      "evidenceStrength": "ADEQUATE",
      "primaryReason": "VALUATION_OPPORTUNITY",
      "freshness": "CURRENT",
      "detail": "/data/scanner/tickers/BISI.json",
      "fairValue": "/fair-value/?ticker=BISI"
    },
    {
      "ticker": "BLOG",
      "name": "PT Trimitra Trans Persada Tbk",
      "sector": "Transportasi & Logistik",
      "state": "RESEARCH_CONFIRMED",
      "stateLabel": "Terkonfirmasi Riset",
      "researchLens": [
        "UNDERVALUED"
      ],
      "evidenceStrength": "ADEQUATE",
      "primaryReason": "VALUATION_OPPORTUNITY",
      "freshness": "CURRENT",
      "detail": "/data/scanner/tickers/BLOG.json",
      "fairValue": "/fair-value/?ticker=BLOG"
    },
    {
      "ticker": "BMHS",
      "name": "PT Bundamedik Tbk",
      "sector": "Kesehatan",
      "state": "RESEARCH_CONFIRMED",
      "stateLabel": "Terkonfirmasi Riset",
      "researchLens": [
        "UNDERVALUED"
      ],
      "evidenceStrength": "ADEQUATE",
      "primaryReason": "VALUATION_OPPORTUNITY",
      "freshness": "CURRENT",
      "detail": "/data/scanner/tickers/BMHS.json",
      "fairValue": "/fair-value/?ticker=BMHS"
    },
    {
      "ticker": "BMTR",
      "name": "PT Global Mediacom Tbk",
      "sector": "Barang Konsumen Non-Primer",
      "state": "RESEARCH_CONFIRMED",
      "stateLabel": "Terkonfirmasi Riset",
      "researchLens": [
        "UNDERVALUED"
      ],
      "evidenceStrength": "ADEQUATE",
      "primaryReason": "VALUATION_OPPORTUNITY",
      "freshness": "CURRENT",
      "detail": "/data/scanner/tickers/BMTR.json",
      "fairValue": "/fair-value/?ticker=BMTR"
    },
    {
      "ticker": "BOLT",
      "name": "PT Garuda Metalindo Tbk",
      "sector": "Barang Konsumen Non-Primer",
      "state": "RESEARCH_CONFIRMED",
      "stateLabel": "Terkonfirmasi Riset",
      "researchLens": [
        "UNDERVALUED"
      ],
      "evidenceStrength": "ADEQUATE",
      "primaryReason": "VALUATION_OPPORTUNITY",
      "freshness": "CURRENT",
      "detail": "/data/scanner/tickers/BOLT.json",
      "fairValue": "/fair-value/?ticker=BOLT"
    },
    {
      "ticker": "BRIS",
      "name": "PT Bank Syariah Indonesia Tbk",
      "sector": "Emiten Syariah / Perusahaan Publik Syariah",
      "state": "RESEARCH_CONFIRMED",
      "stateLabel": "Terkonfirmasi Riset",
      "researchLens": [
        "UNDERVALUED"
      ],
      "evidenceStrength": "ADEQUATE",
      "primaryReason": "VALUATION_OPPORTUNITY",
      "freshness": "CURRENT",
      "detail": "/data/scanner/tickers/BRIS.json",
      "fairValue": "/fair-value/?ticker=BRIS"
    },
    {
      "ticker": "BRNA",
      "name": "PT Berlina Tbk",
      "sector": "Barang Baku",
      "state": "RESEARCH_CONFIRMED",
      "stateLabel": "Terkonfirmasi Riset",
      "researchLens": [
        "UNDERVALUED"
      ],
      "evidenceStrength": "ADEQUATE",
      "primaryReason": "VALUATION_OPPORTUNITY",
      "freshness": "CURRENT",
      "detail": "/data/scanner/tickers/BRNA.json",
      "fairValue": "/fair-value/?ticker=BRNA"
    },
    {
      "ticker": "BSDE",
      "name": "PT Bumi Serpong Damai Tbk",
      "sector": "Properti & Real Estat",
      "state": "RESEARCH_CONFIRMED",
      "stateLabel": "Terkonfirmasi Riset",
      "researchLens": [
        "UNDERVALUED"
      ],
      "evidenceStrength": "ADEQUATE",
      "primaryReason": "VALUATION_OPPORTUNITY",
      "freshness": "CURRENT",
      "detail": "/data/scanner/tickers/BSDE.json",
      "fairValue": "/fair-value/?ticker=BSDE"
    },
    {
      "ticker": "BTPS",
      "name": "PT Bank BTPN Syariah Tbk",
      "sector": "Emiten Syariah / Perusahaan Publik Syariah",
      "state": "RESEARCH_CONFIRMED",
      "stateLabel": "Terkonfirmasi Riset",
      "researchLens": [
        "UNDERVALUED"
      ],
      "evidenceStrength": "ADEQUATE",
      "primaryReason": "VALUATION_OPPORTUNITY",
      "freshness": "CURRENT",
      "detail": "/data/scanner/tickers/BTPS.json",
      "fairValue": "/fair-value/?ticker=BTPS"
    },
    {
      "ticker": "CAMP",
      "name": "PT Campina Ice Cream Industry, Tbk.",
      "sector": "Barang Konsumen Primer",
      "state": "RESEARCH_CONFIRMED",
      "stateLabel": "Terkonfirmasi Riset",
      "researchLens": [
        "UNDERVALUED"
      ],
      "evidenceStrength": "ADEQUATE",
      "primaryReason": "VALUATION_OPPORTUNITY",
      "freshness": "CURRENT",
      "detail": "/data/scanner/tickers/CAMP.json",
      "fairValue": "/fair-value/?ticker=CAMP"
    },
    {
      "ticker": "CEKA",
      "name": "PT Wilmar Cahaya Indonesia Tbk.",
      "sector": "Barang Konsumen Primer",
      "state": "RESEARCH_CONFIRMED",
      "stateLabel": "Terkonfirmasi Riset",
      "researchLens": [
        "UNDERVALUED"
      ],
      "evidenceStrength": "ADEQUATE",
      "primaryReason": "VALUATION_OPPORTUNITY",
      "freshness": "CURRENT",
      "detail": "/data/scanner/tickers/CEKA.json",
      "fairValue": "/fair-value/?ticker=CEKA"
    },
    {
      "ticker": "CPIN",
      "name": "PT Charoen Pokphand Indonesia Tbk",
      "sector": "Barang Konsumen Primer",
      "state": "RESEARCH_CONFIRMED",
      "stateLabel": "Terkonfirmasi Riset",
      "researchLens": [
        "UNDERVALUED"
      ],
      "evidenceStrength": "ADEQUATE",
      "primaryReason": "VALUATION_OPPORTUNITY",
      "freshness": "CURRENT",
      "detail": "/data/scanner/tickers/CPIN.json",
      "fairValue": "/fair-value/?ticker=CPIN"
    },
    {
      "ticker": "CPRO",
      "name": "PT Central Proteina Prima Tbk",